{
  "spell": "primer_via_mcp_v0_3",
  "intent": "Read local primers through MCP resources, synthesize them, and stage the result through an MCP tool.",
  "inputs": {},
  "constraints": {
    "risk": "medium",
    "required_capabilities": ["read", "transform", "verify", "write"],
    "requires_approval_for": ["write"]
  },
  "graph": [
    {
      "id": "gather",
      "rune": "mirror.mcp_read_resources",
      "effect": "read",
      "args": {
        "server_cmd": ["python", "../adapters/demo_mcp_server.py"],
        "pattern": "Primer transcript"
      }
    },
    {
      "id": "brief",
      "rune": "forge.summarize",
      "effect": "transform",
      "args": { "from": "$gather.texts", "title": "Axiomurgy MCP Primer Relay" }
    },
    {
      "id": "review",
      "rune": "seal.review",
      "effect": "verify",
      "args": {
        "from": "$brief",
        "must_include": ["Recurring themes", "Source 1", "Source 7"]
      }
    },
    {
      "id": "stage",
      "rune": "gate.mcp_call_tool",
      "effect": "write",
      "args": {
        "server_cmd": ["python", "../adapters/demo_mcp_server.py"],
        "name": "stage_note",
        "arguments": {
          "path": "relay/primer_via_mcp_v0_3.md",
          "content": "$brief"
        }
      },
      "requires": ["review"]
    }
  ],
  "witness": { "record": true, "format": "prov-like" }
}
